1208537026||CF082A |HP|HP Color LaserJet Enterprise 500 M551DN - CF082A|Eine Farbbereicherung für Ihr Büro: Der von Ihrem Profi aufbereitete & gebrauchte HP Color LaserJet Enterprise 500 M551DN mit Autoduplex, Netzwerkintegration und einem zusätzlichen Hi-Speed USB 2.0 Hostanschluss für Walk-up USB-Druck ist ihr innovativer Farbdruckpartner. Über das vierzeilige Farbdisplay des Color LaserJet Enterprise 500 M551DN lassen sich Druckaufträge direkt verwalten und über ein USB-Flashlaufwerk problemlos ausdrucken. Mit HP ePrint wird das Drucken beim HP Color LaserJet Enterprise 500 M551DN Duplexer so mobil wie Sie es sind - von nun an können Sie von praktisch überall aus drucken. Mit HP Color Access Control lässt sich der Farbverbrauch beim HP Color LaserJet Enterprise 500 M551DN mühelos überwachen und die branchenführende HP Web Jetadmin Software sorgt für die proaktive Verwaltung von Druckumgebungen.|Kopiererhaus > Drucker|249.00|4-7 Tage|https://www.kopiererhaus.de/hp-color-laserjet-enterprise-500-m551dn-cf082a|https://www.kopiererhaus.de/media/catalog/product/4/3/435962.jpg|35.00
1226627031||BIZHUBC30P|Konica Minolta|Konica Minolta bizhub C30P|Der Konica Minolta bizhub C30P ist ein Farblaserdrucker.|Kopiererhaus > Drucker|299.00|4-7 Tage|https://www.kopiererhaus.de/konica-minolta-bizhub-c30p|https://www.kopiererhaus.de/media/catalog/product/1/2/1226627031_600627.jpg|35.00
1226947551||BIZHUBC35P|Konica Minolta|Konica Minolta bizhub C35P|Der Konica Minolta bizhub C35P ist ein Farblaserdrucker.|Kopiererhaus > Drucker|199.00|4-7 Tage|https://www.kopiererhaus.de/konica-minolta-bizhub-c35p|https://www.kopiererhaus.de/media/catalog/product/1/2/1226947551_797181.jpg|35.00
1226971071||A0VD021|Konica Minolta|Konica Minolta Magicolor 4750EN - A0VD021|Schnell und Vielseitig: Der fachmännisch runderneuerte & gebrauchte Konica Minolta Magicolor 4750EN ist mit seiner geringen Höhe und den kompakten Abmessungen die perfekte Wahl für die vielfältigen Druckanforderungen kleinerer Büros. Nutzen Sie die Vorteile effizienten Netzwerkdrucks durch den Magicolor 4750EN mit 30 Seiten pro Minute in Farbe und Schwarzweiß. Mit gerade mal 12,9 Sekunden bis zum Ausdruck der ersten Seite drucken Sie mit dem Konica Minolta Magicolor 4750EN Einzelseiten und kleine Druckaufträge flexibel und kostengünstig und verlieren dabei keine Zeit. Und wenn Sie öfter größere Druckaufträge erledigen müssen, erweitern Sie den Magicolor 4750EN doch mit einer optionalen Papierkassette und erhöhen so die Effizienz, ohne zusätzliche Stellfläche an Ihrem Arbeitsplatz zu benötigen.|Kopiererhaus > Drucker|499.00|4-7 Tage|https://www.kopiererhaus.de/konica-minolta-magicolor-4750en-a0vd021|https://www.kopiererhaus.de/media/catalog/product/1/2/1226971071_203912.jpg|35.00
1230675416||25A0460 |Lexmark|Lexmark C736N - 25A0460|Der zuverlässige Office Partner: Der von unseren Profis aufbereitete & gebrauchte Lexmark C736N kann Dank seiner umfangreichen Papierzuführungskapazität und einer flexiblen Medienunterstützung auch voluminöse Jobs mit weniger Bedienereingriffen und verbesserter Produktivität verarbeiten. Zudem bietet Ihnen der Lexmark C736N zuverlässigen Farbdruck mit herausragender Qualität, schnelle Druckgeschwindigkeiten und Business-Class-Leistung, um mit Ihren höchsten Volumen Schritt zu halten. Durch die verbesserte Farbtonerrezeptur des C736N drucken Sie brillante Grafiken und Bilder und erzielen konsistente Farbtöne mit professioneller Pantone-Kalibrierung. Darüber profitieren Sie mit dem Lexmark C736N von einer kompletten Reihe an Farbzugriffs und Kontrollfunktionen, mit denen gewährleistet wird, dass Ihre Arbeitsgruppe effizient und intelligent druckt.|Kopiererhaus > Drucker|199.00|4-7 Tage|https://www.kopiererhaus.de/lexmark-c736n-25a0450|https://www.kopiererhaus.de/media/catalog/product/1/2/1230675416_809037.jpg|35.00
1233117756||13C1231|Lexmark|Lexmark X466DE MFP - 13C1231 - 4-in-1|Funktionen für höchste Produktivität: Der von unseren Profis aufbereitete & gebrauchte Lexmark X466DE ist eine vollständig konfigurierte Mutltifunktionslösung und zeichnet sich durch sein platzsparendes Design, fortschrittliche Funktionen und eine integrierte 80GB Festplatte aus. Der Lexmark X466DE als produktivitätssteigerer für kleine und mittlere Arbeitsgruppen hat ein großer Farb-Touchscreen für höchste Bedienerfreundlichkeit und bietet einen schnellen, einfachen Zugriff auf Dokumentenerfassungs- und Workflow-Funktionen. Zudem überzeugt der X466DE mit modernsten Sicherheitsfunktionen, einer sehr einfachen Implementierung und dem Lexmark Embedded Solutions Framework. Diese integrierte Lösungsschnittstelle des Lexmark X466DE ermöglicht eine einfache Anpassung an Ihre ganz spezifischen Druckanforderungen. Hier bei uns im Shop bekommen Sie den bedienerfreundlichen Lexmark X466DE gebraucht und zum spezifisch niedrig gehaltenen Preis. Ab in den Warenkorb und erhalten Sie mit dem Lexmark X466DE einen MFP mit Funktionen für höchste Produktivität!|Kopiererhaus > Drucker, Kopiererhaus > Topseller, Kopiererhaus > Kopierer s/w|399.00|4-7 Tage|https://www.kopiererhaus.de/lexmark-x466de-mfp-13c1231-4-in-1|https://www.kopiererhaus.de/media/catalog/product/1/2/1233117756_334136.jpg|35.00
1274165656||35S5750|Lexmark|Lexmark MX310DN MFP - 35S5750 - 4-in-1|Mehr Leistung in kürzester Zeit: Der von unseren Profis für Sie aufbereitete & gebrauchte Lexmark MX310DN optimiert Ihre Workflows und Ihre Effizienz im Handumdrehen zu einem akzeptablen Preis. Mit dem Lexmark MX310DN erleben Sie Druckgeschwindigkeiten bis zu 33 Seiten pro Minute plus eine Ausgabe der ersten gedruckten oder kopierten Seite in nur 6,5 Sekunden. Zudem verbessern Sie mit dem MX310DN Ihre Druck-, Scan- und Kopiergeschwindigkeit, indem Sie den 256 MB großen Speicher und einen 800 MHz Dual-Core-Prozessor nutzen. Mit einer maximalen Zuführungskapazität von bis zu 850 Blatt und einer Tonerkassette mit hoher Kapazität müssen Sie beim Lexmark MX310DN noch seltener Papier nachlegen oder Kassetten austauschen. Mit echter Auflösung von 1.200 x 1.200 dpi sind Bilder und Grafiken mit dem MX310DN immer gestochen scharf und darüber hinaus sorgt der Unison™ Toner von Lexmark für gleichbleibend hohe Qualität.|Kopiererhaus > Kopierer s/w|189.00|4-7 Tage|https://www.kopiererhaus.de/lexmark-mx310dn-mfp-35s5750-4-in-1|https://www.kopiererhaus.de/media/catalog/product/1/2/1274165656_669822.jpg|35.00
1364265325||28D0020 |Lexmark|Lexmark CS410N - 28D0020|Ausgelegt für höhere Produktivität: Der technisch runderneuerte & gebrauchte Lexmark CS410N Farblaserdrucker liefert kostengünstige PANTONE®  Farbabstimmung und intelligente Druckfunktionen, die sonst nur auf High-End-Systemen zu finden sind. Der Lexmark CS410N Drucker arbeitet mit gleichbleibender Qualität, sodass Sie Ihre mit Logo versehenen Materialien auch inhouse drucken können. Mit dem CS410N drucken Sie Dokumente mit Grafiken und Bildern mühelos mit 256 MB erweiterbarem Speicher und einem schnellen Dual-Core-Prozessor. Zudem überzeugt der Lexmark CS410N mit einer echtern Auflösung von 1.200 x 1.200 dpi und liefert Ihnen immer gestochen scharfe Bilder und Grafiken. Mit hellem LCD-Farbdisplay, komfortablem frontseitigen USB-Anschluss, hoher Papierzufuhrkapazität und vielen weiteren Features arbeitet Ihr Team mit dem Lexmark CS410N noch produktiver.|Kopiererhaus > Drucker|199.00|3-4 Tage|https://www.kopiererhaus.de/lexmark-cs410n-28d0020|https://www.kopiererhaus.de/media/catalog/product/1/3/1364265325_467901.jpg|35.00
1413841450||BIZHUB164|Konica Minolta|Konica Minolta bizhub 164 MFP bis A3|Anwenderfreundlich multifunktional: Der professionell runderneuerte & gebrauchte Konica Minolta bizhub 164 ist ein Multifunktionssystem, dass bereits standardmäßig die drei Funktionen Drucken, Kopieren und Scannen kombiniert. Der bizhub 164 ist robust, verarbeitet sogar A3-Formate und hat eine erstklassige Ökobilanz.Das Bedienfeld des Konica Minolta bizhub 164 sorgt durch die Cursortasten für eine einfache Navigation, ist selbsterklärend und auch für Ungeübte leicht zu verstehen. In Kombination mit einer Kopiergeschwindigkeit von bis zu 16 Seiten pro Minute und einer Zeit von nur 8 Sekunden bis zum Ausdruck der ersten Seite sparen Sie mit dem bizhub 164 Zeit - und lange Wartezeiten am System gehören definitiv der Vergangenheit an.|Kopiererhaus > Kopierer s/w|555.00|4-7 Tage|https://www.kopiererhaus.de/konica-minolta-bizhub-164-mfp-bis-a3|https://www.kopiererhaus.de/media/catalog/product/1/4/1413841450_223960.jpg|35.00
1414192815||MP1900|Ricoh|Ricoh Aficio MP1900 Digitalkopierer bis A3|Optimieren Sie Ihren Arbeitsablauf: Der tip top generalüberholte & gebrauchte Ricoh Aficio MP 1900 A3 Kopierer trägt mit einer Ausgabe von 19 Seiten pro Minute wesentlich zur Verbesserung Ihres Workflows bei. Als hocheffizentes System hat der Aficio MP 1900 eine Aufwärmzeit von weniger als 10 Sekunden und den ersten Druck halten Sie bereits nach 6,5 Sekunden in den Händen.|Kopiererhaus > Kopierer s/w|499.00|4-7 Tage|https://www.kopiererhaus.de/ricoh-aficio-mp1900-digitalkopierer-bis-a3|https://www.kopiererhaus.de/media/catalog/product/1/4/1414192815_286973.jpg|35.00
1418956800||1102LX3NL0|Kyocera|Kyocera FS-3140MFP 4-in-1 - 1102LX3NL0|Höchste Flexibilität und Erweiterbarkeit: Der fachmännisch runderneuerte & gebrauchte Kyocera FS-3140MFP überzeugt mit rasanten 40 Seiten pro Minute und integrierter Netzwerkschnittstelle. Der Kyocera FS-3140MFP ist der perfekte Allrounder für mittlere und große Arbeitsgruppen und mit einer Kapazität von bis zu 2.100 Blatt sowie integrierter Duplex-Einheit ist der FS-3140 auch für höhere Anforderungen gerüstet. Neben Drucken, Kopieren und Scannen bietet Ihnen der Kyocera FS-3140MFP zudem standardmäßig Fax. Durch seine vielfältigen Erweiterungsoptionen können Sie den FS-3140MFP einfach und flexibel den Bedürfnissen Ihrer Arbeitsumgebung anpassen.|Kopiererhaus, Kopiererhaus > Kopierer s/w|499.00|4-7 Tage|https://www.kopiererhaus.de/kyocera-fs-3140mfp-4-in-1-1102lx3nl0|https://www.kopiererhaus.de/media/catalog/product/1/4/1418956800_462423.jpg|35.00
2165339260||Q1860A + LAN|HP|HP LaserJet 5100N bis A3|Der HP LaserJet 5100N ist ein Laserdrucker.|Kopiererhaus > Drucker|369.00|4-7 Tage|https://www.kopiererhaus.de/hp-laserjet-5100n-bis-a3|https://www.kopiererhaus.de/media/catalog/product/h/p/hp_laserjet_5100n.jpg|35.00
1596825140||CD645A|HP|HP LaserJet Enterprise 500 Color MFP M575f - CD645A 4-in-1|Sicherheit und Komfort: Der HP Farblaserdrucker MFP M575f ist ein 4-in-1 Multifunktionsgerät der HP-M575 Serie. Zusätzlich zu den Funktionen des M575dn bietet der HP LaserJet Enterprise 500 Color MFP M575f standardmäßig Fax-Funktionalität und integrierte manuelle Heftfunktion. Über das schwenkbare, farbige Touchscreen-Display (8.0 Zoll) können Sie Druckaufträge verwalten und bei Bedarf Seiten einfügen, löschen und umsortieren. Mit einer Druckauflösung von bis zu 1.200 x 1.200 dpi sind bei Verwendung von Original HP ColorSphere Toner hochwertige Farbausdrucke garantiert. Hohe Sicherheit für Ihre Unternehmensdaten bietet der LaserJet MFP M575f durch die standardmäßig integrierte Sicherheitsfestplatte (250 GB), die Hardwareverschlüsselung AES 128 oder höher und sichere Löschfunktionen (sicheres Löschen von temporären Druckjobs und Druckdaten, sicheres Löschen der ATA Festplatte).|Kopiererhaus > Farbkopierer|880.00|4-7 Tage|https://www.kopiererhaus.de/hp-laserjet-enterprise-500-color-mfp-m575f-cd645a-4-in-1|https://www.kopiererhaus.de/media/catalog/product/h/p/hp-laserjet-enterprise-500-color-m575dn-_cd644a_-mfp_5.jpg|35.00
1636641895||CE863A|HP|HP LaserJet Pro 400 color MFP M475dn - CE863A 4-in-1|Der HP LaserJet Pro 400 color MFP M475dn ist eine Multifunktionsgerät, mit dem Sie kopieren, scannen, faxen und drucken können. Bis zu 20 Seiten pro Minute werden in schwarz-weiß oder Farbe gedruckt, je nach Einstellung einseitig oder als Duplexdruck. Die stufenlose Schattierungsmöglichkeit des HP LaserJet Pro 400 color liefert hochwertige Farbergebnisse. Damit können zum Beispiel Marketingmaterialien professionell erstellt und ausgedruckt werden - per ePrint und AirPrint auch direkt von mobilen Endgeräten aus. Über den Ethernetanschluß ist der MFP M475dn in Ihr Netzwerk eingebunden und ermöglicht so auch die digitale Speicherung Ihrer Dokumente.|Kopiererhaus > Farbkopierer|599.00|4-7 Tage|https://www.kopiererhaus.de/hp-laserjet-pro-400-color-mfp-m475dn-ce863a|https://www.kopiererhaus.de/media/catalog/product/h/p/hp-laserjet-pro-m475dn.jpg|35.00
1480475815||CLX-6210FX/SEE|Samsung|Samsung CLX 6210FX MFP 4-in-1|Mit dem Samsung CLX 6210FX erwerben Sie ein platzsparendes Multifunktionsgerät, mit dem Sie bis zu 20 Seiten pro Minute sowohl in Schwarzweiß als auch in Farbe drucken können. Die erste Seite wird nach knapp 25 Sekunden gedruckt. Automatisches Duplexing gehört selbstverständlich zur Standardausstattung. Das Handling unterschiedlicher Medientypen wie Briefumschläge und Etiketten wird vom Samsung CLX 6210FX spielend leicht bewältigt.|Kopiererhaus > Farbkopierer|444.00|4-7 Tage|https://www.kopiererhaus.de/samsung-clx-6210fx-mfp-4-in-1|https://www.kopiererhaus.de/media/catalog/product/s/a/samsung_clx_6210fx.jpg|35.00
1480514515||SCX-5635FN/SEE|Samsung|Samsung SCX-5635FN MFP 4-in-1|Mit dem Samsung SCX 5635FN erwerben Sie ein platzsparendes Multifunktionsgerät, mit dem Sie bis zu 33 Seiten pro Minute in Schwarzweiß drucken können. Die erste Seite wird nach 8,5 Sekunden gedruckt. Automatisches Duplexing gehört selbstverständlich zur Standardausstattung. Das Handling unterschiedlicher Medientypen wie Briefumschläge und Etiketten wird vom Samsung SCX 5635FN spielend leicht bewältigt.|Kopiererhaus > Kopierer s/w|289.00|4-7 Tage|https://www.kopiererhaus.de/samsung-scx-5635fn-mfp-4-in-1|https://www.kopiererhaus.de/media/catalog/product/s/a/samsung_scx_5635fn.jpg|35.00
BIZHUB 131F||BIZHUB131F|Konica Minolta|Konica Minolta bizhub 131F MFP 4-in-1|Konzipiert für kleine Büros erfüllt der praktische Konica Minolta bizhub 131F alle Anforderungen an ein professionelles Multifunktionsgerät. Vom Fachmann runderneuert & gebraucht ist dieses Helferlein der ideale Begleiter für alle, die zuverlässig drucken, kopieren und faxen möchten. Der Laserdrucker produziert 13 s/w- Ausdrucke pro Minute und ermöglicht einen Originaleinzug für bis zu 80 Seiten. Dank einem umfangreichen Papiervorrat von bis zu 1.050 Blatt lassen sich auch große Druckaufträge problemlos umsetzen. Sparen Sie bares Geld dank einem geringen Tonerverbrauch durch den extrafeinen Polymerisationstoner. Mit einem Speicher für 160 Kurz- und 40 Zielwahlnummern erreicht das Gerät hohen Komfort beim Faxen und verschafft Ihnen mit bis zu 100 Kostenstellen für Fax und Kopie jederzeit einen Überblick über Ihre Betriebskosten. Mittels Netzwerkschnittstelle ist der Alleskönner für die Papierformate A6, A5 und A4 überall anwählbar und überzeugt auf ganzer Linie durch simple Handhabung und hohe Effizienz. |Kopiererhaus > Kopierer s/w|199.00|4-7 Tage|https://www.kopiererhaus.de/konica-minolta-bizhub-131f-mfp-4-in-1|https://www.kopiererhaus.de/media/catalog/product/b/i/bizhub131f.jpg|35.00
P6021cdn ||P 6021cdn |Kyocera|Kyocera ECOSYS P6021cdn|Kyocera ECOSYS P6021cdn|Kopiererhaus > Drucker|499.00|4-7 Tage|https://www.kopiererhaus.de/kyocera-ecosys-p6021cdn|https://www.kopiererhaus.de/media/catalog/product/k/y/kyocera_ecosys_p6021cdn.jpg|35.00
1634132535||35S6749|Lexmark|Lexmark MX611DE - 35S6749 MFP 4-in-1|Lexmark MX611DE - 35S6749 MFP 4-in-1|Kopiererhaus > Kopierer s/w|499.00|4-7 Tage|https://www.kopiererhaus.de/lexmark-mx611de-35s6749-mfp-4-in-1|https://www.kopiererhaus.de/media/catalog/product/m/x/mx611de.jpg|35.00
1634127665||28D0509|Lexmark|Lexmark CX410e - 28D0509 MFP 4-in-1|Hier brillieren nicht nur die Farben: Der Lexmark CX410e ist ein vielseitiges und leistungsstarkes Multifunktionsgerät für anspruchsvolle Anwender. Der Laserdrucker steigert Ihre Produktivität mit einer Druckgeschwindigkeit von bis zu 30 A4-Seiten pro Minute – sowohl in s/w als auch in Farbe – sowie einer identisch rasanten Scangeschwindigkeit für die Digitalisierung Ihrer Geschäftsunterlagen. Das Tischgerät, ausgestattet mit einer Netzwerkschnittstelle für die einfach Integration in Ihre Arbeitsumgebung, arbeitet mit den Papierformaten A4 und A5. Trotzen Sie unnötigen Arbeitsunterbrechungen: Mit einer Zuführungskapazität von bis zu 1.450 Blatt  und modernster Papierhandhabung ist ein durchgängiger Workflow gewährleistet. Zusätzlich besticht das Gerät durch bequeme Bedienbarkeit mittels 10,9cm-Farbtouchscreen und einem frontseitigen USB-Anschluss für unmittelbares Arbeiten.  |Kopiererhaus > Farbkopierer|349.00|4-7 Tage|https://www.kopiererhaus.de/lexmark-cx410e-28d0509-mfp-4-in-1|https://www.kopiererhaus.de/media/catalog/product/l/e/lexmark_cx410e.jpg|35.00
1626640435||DCP8085DNG1|Brother|Brother DCP-8085DN|Vielfältigkeit in kompaktem Format: Der Brother DCP-8085DN ist ein leistungsstarkes Raumwunder, das auch Sie von seinen Fähigkeiten überzeugen wird. Das Tischgerät aus dem Hause Brother druckt rasant bis zu 30 Seiten in einer Minute bei einer gestochen scharfen Auflösung von 1.200 dpi. In den Formaten A6, A5 und A4 liefert der 8085DN Ergebnisse, die sich sehen lassen können. Veredeln auch Sie Ihre Geschäftsunterlagen mit dem vorinstallierten Broschürendruck oder steigern Sie ihre Produktivität dank der integrierten Duplex-Einheit. Mit der Netzwerkschnittstelle lässt sich das Multifunktionsgerät kinderleicht in jedes Arbeitsumfeld integrieren und ist außerdem über den USB-Port unmittelbar einsatzbereit.  |Kopiererhaus > Kopierer s/w|169.00|4-7 Tage|https://www.kopiererhaus.de/brother-dcp-8085dn|https://www.kopiererhaus.de/media/catalog/product/d/c/dcp-8085dn.jpg|35.00
1637671615||iR1024iF|Canon|Canon iR 1024iF MFP 4-in-1|Ein Highlight aus dem Hause Canon: Der vom Fachmann runderneuerte Canon iR 1024iF ist ein Multifunktionsgerät, das auch anspruchsvolle Anwender mit seiner Leistung überzeugt. Das kompakte Tischgerät ist die optimale Bürolösung für Home-Offices und kleine Arbeitsgruppen und lässt sich dank Netzwerkschnittstelle spielend in die bestehende Umgebung einbinden. Mit einer Druckgeschwindigkeit von bis zu 24 Seiten pro Minute bearbeitet das Tischgerät rasant auch größere Druckaufträge in gestochen scharfer Auflösung. Nicht nur passt das Gerät auf jeden Tisch, es ist mit seinen Funktionalitäten im Bereich Druck, Kopie, Scan und Fax auch vielseitig einsetzbar. Dank automatischem Vorlageneinzug (ADF) und integrierter Duplexeinheit erleichtert der 1024iF Ihren Arbeitsalltag und schont überdies Ihren Geldbeutel.  |Kopiererhaus > Kopierer s/w|899.00|4-7 Tage|https://www.kopiererhaus.de/canon-ir-1024if-mfp-4-in-1|https://www.kopiererhaus.de/media/catalog/product/c/a/canon_ir_1024if.jpg|35.00
1637679785||iR1024A|Canon|Canon iR 1024A MFP|Ein Allzwecksystem für jede Lebenslage: Der Canon iR 1024A ist ein vom Fachmann aufgearbeitetes Multifunktionsgerät. Mit Druck, Scan und Kopie in kompakter Form passt das Gerät aus dem Hause Canon auf jeden Schreibtisch. Professionelle Schwarzweiß-Dokumente drucken Sie mit dem 1024A innerhalb von kürzester Zeit auch im Duplexdruck. Bei einer Druckgeschwindigkeit von 24 Seiten pro Minute und einer Scangeschwindigkeit von bis zu 20 Seiten pro Minute in s/w ist dieses Helferlein auch großen Datenmengen durchaus gewachsen. Dank der Netzwerkschnittstelle können Sie das Gerät kurzerhand in Ihre Arbeitsumgebung integrieren, sodass es von allen Beteiligten angesteuert werden kann.  |Kopiererhaus > Kopierer s/w|399.00|4-7 Tage|https://www.kopiererhaus.de/canon-ir-1024a-mfp|https://www.kopiererhaus.de/media/catalog/product/i/r/ir1024a.jpg|35.00
1637680940||0484B001|Canon|Canon iR 1022iF - 0484B001 MFP 4-in-1|Vom Experten generalüberholt wird Sie dieses Multifunktionsgerät aus dem Hause Canon begeistern: Der iR 1022iF ist eine ebenso kompakte wie leistungsstarke Arbeitseinheit für Druck, Scan, Kopie und Fax. Das praktische Tischgerät macht trotz seiner geringen Größe keine Abstriche in puncto Geschwindigkeit. Mit bis zu 22 Seiten pro Minute in s/w und integriertem Duplexdruck ist es allen Herausforderungen des Tagesgeschäfts gewachsen und produziert brillante Druckergebnisse auf den Papierformaten A5, A5+, A4 sowie A4+. Auch hochwertige Farbscans sind für das Raumwunder kein Problem. Mit einer Scanauflösung von 600 ppi digitalisieren Sie Ihre Geschäftsdokumente mit bis zu 6 Seiten pro Minute.  |Kopiererhaus > Kopierer s/w|349.00|4-7 Tage|https://www.kopiererhaus.de/canon-ir-1022if-0484b001-mfp-4-in-1|https://www.kopiererhaus.de/media/catalog/product/i/r/ir1024a_1.jpg|35.00
1637687155||iR1022i|Canon|Canon iR 1022i - 0482B001 MFP 4-in-1|Ein kompaktes Arbeitsgerät für Ihren Schreibtisch: Der Canon iR 1022i ist ein Multifunktionsgerät für anspruchsvolle Anwender, das in Druck, Scan und Kopie erstklassige Ergebnisse liefert. Mit einer Druckgeschwindigkeit von bis zu 22 Seiten pro Minute und einer Auflösung von 1.200 x 600 dpi ist das platzsparende Gerät ein Garant für schnelle und qualitativ hochwertige Druckerzeugnisse. Auch in puncto Scangeschwindigkeit steigert der 1022i Ihre Produktivität: In einer Minute scannt er bis zu 20 Seiten in s/w oder 6 Seiten in Farbe, sodass Sie Ihre Dokumente in kürzester Zeit digitalisieren und für andere Nutzer zugänglich machen können. Dank Netzwerkschnittstelle ist der Bürohelfer aus dem Hause Canon für alle Anwender in der Umgebung unmittelbar einsatzbereit.  |Kopiererhaus > Kopierer s/w|349.00|4-7 Tage|https://www.kopiererhaus.de/canon-ir-1022i-0482b001-mfp-4-in-1|https://www.kopiererhaus.de/media/catalog/product/i/r/ir1024a_1_1.jpg|35.00
1637689715||iR1133A|Canon|Canon iR 1133A MFP|Wirtschaftlich, umweltfreundlich und sicher: Der vom Experten runderneuert Canon iR 1133A ist ein sparsames Multifunktionsgerät für Druck, Scan und Kopie. Der Laserdrucker aus dem Hause Canon besticht mit einer brillanten Druckauflösung von 1.200 dpi und einer Druckgeschwindigkeit von bis zu 33 Seiten pro Minute. Mit integrierter Duplexdruck-Einheit und einem niedrigen Verbauch von nur 2,5 Watt im Ruhemodus ist das Gerät die richtige Wahl für umweltbewusste Anwender. Dank einer Blattkapazität von bis zu 1.050 Blatt überzeugt das kompakte Tischgerät auch bei großen Druckaufträgen. Unnötige Unterbrechungen und lange Wartezeiten gehören der Vergangenheit an. Das gilt auch für die Digitalisierung Ihrer Geschäftsdokumente, die Sie mit einer Geschwindigkeit von bis zu 28 Seiten pro Minute einscannen können. Nutzen Sie die Netzwerkschnittstelle für eine rasche Integration in Ihre Arbeitsumgebung oder den USB-Port für unmittelbares Drucken vom Speichermedium.  |Kopiererhaus > Kopierer s/w|399.00|4-7 Tage|https://www.kopiererhaus.de/canon-ir-1133a-mfp|https://www.kopiererhaus.de/media/catalog/product/i/r/ir1133a.jpg|35.00
1669716850||A034022|Konica Minolta|Konica Minolta Magicolor 1650EN - A034022|Konica Minolta Magicolor 1650EN - A034022|Kopiererhaus > Drucker|199.00|4-7 Tage|https://www.kopiererhaus.de/konica-minolta-magicolor-1650en-a034022|https://www.kopiererhaus.de/media/catalog/product/k/o/konica_minolta_magicolor_1650en.jpg|35.00
1676937715||CLP-620ND|Samsung|Samsung CLP-620ND|Brillante Farbergebnisse für kostenbewusste Anwender: Der vom Fachmann aufgearbeitete Samsung CLP-620ND ist perfekt geeignet für kleine bis mittelgroße Arbeitsgruppen. Dank integrierter Duplexdruck-Einheit und hoher Tonerreichweite spart dieses Gerät bares Geld. Mit 20 ausgeworfenen Seiten pro Minute in s/w und Farbe liefert der Farblaserdrucker aus dem Hause Samsung eine gleichbleibend optimale Druckqualität in einer Auflösung von 9.600 x 600. Via Netzwerkschnittstelle implementieren Sie das Gerät unmittelbar in Ihre Arbeitsumgebung oder nutzen es direkt über den USB-Port von Ihrem Speichermedium.  |Kopiererhaus, Kopiererhaus > Drucker|299.00|4-7 Tage|https://www.kopiererhaus.de/samsung-clp-620nd|https://www.kopiererhaus.de/media/catalog/product/s/a/samsung_clp-620nd.jpg|35.00
171SPF||171SPF|Ricoh|Ricoh Aficio MP 171 SPF - MFP 4-in-1|Ein Netzwerk-Allrounder wie er im Buch steht: Der vom Experten generalüberholte Ricoh Aficio MP 171 SPF ist ein energiesparendes Multifunktionsgerät, das auch für anspruchsvolle Anwender bestens geeignet ist. Der Schwarzweiß-Laserdrucker arbeitet mit den Papierformaten A6, A5 und A4 und ermöglicht dank integrierter Duplexdruck-Einheit und automatischem Vorlageneinzug produktives und schnelles Arbeiten. Mit einer Druckgeschwindigkeit von bis zu 17 Seiten pro Minute und einer Scangeschwindigkeit von bis zu 22 Seiten pro Minute ist das Gerät vor allem für kleine Arbeitsgruppen und Home-Offices zu empfehlen. Die Fax-Funktion macht den netzwerkfähigen 171 SPF zu einem echten Multitalent, das auch Sie in Ihrem Tagesgeschäft optimal unterstützen wird.  |Kopiererhaus > Kopierer s/w|699.00|4-7 Tage|https://www.kopiererhaus.de/ricoh-aficio-mp-171-spf-mfp-4-in-1|https://www.kopiererhaus.de/media/catalog/product/r/i/ricoh_aficio_171_spf.jpg|35.00
