775091206||Q1862A|HP|HP Laserjet 5100DTN - Q1862A bis A3|Leistungsstarker A3 Druck für CAD und DTP: Der hochwertig runderneuerte & gebrauchte HP LaserJet 5100DTN steigert Ihre Produktivität mit einer Druckgeschwindigkeit von bis zu 22 S./Min. bei DIN A4-Dokumenten und bis zu 11 S./Min. bei DIN A3-Überformat. Eine Papierzuführungskapazität von  Standard 850 Blatt und die integrierte Duplex-Einheit des HP LaserJet 5100DTN garantieren zudem die Bewältigung ihrer großen Druckjobs. Die einfach auszutauschende HP Ultraprecise Druckkassette ermöglicht beim LaserJet 5100DTN eine noch präzisere Bildpunktplatzierung und die Darstellung erweiterter Graustufen. Der intelligente HP LaserJet 5100DTN erleichtert den Anwendern die Arbeit durch einfache Lösungen für die komplexen Druckanforderungen in Arbeitsgruppen.|Kopiererhaus > Drucker|749.00|4-7 Tage|https://www.kopiererhaus.de/hp-laserjet-5100dtn-q1862a-bis-a3|https://www.kopiererhaus.de/media/catalog/product/7/7/775091206_257748.jpg|35.00
775434276||Q7545A|HP|HP LaserJet 5200TN - Q7545A bis A3|Intuitiv, rasant und leistungsstark: Kleine bis mittlere Arbeitsgruppen werden vom dem vom Experten runderneuerten HP LaserJet 5200TN begeistert sein. Gestochen scharfe Ausdrucke, satte Schwarztöne und vielseitige Graustufen sorgen für überzeugene Geschäftsdokumente bis zum A3-Überformat. Produzieren Sie technische Pläne, CAD/CAM-Zeichnungen, Proofs für Marketingmaterial und finanzwirtschaftliche Tabellen mit dem kompakten Tischdrucker von Hewlett Packard. Das zuverlässige Gerät lässt sich problemlos in bestehende Arbeitsumgebungen integrieren und ist sowohl über die Netzwerkschnittstelle als auch über den USB-Anschluss optimal nutzbar. Mit einer empfohlenen Auslastung von bis zu 65.000 Seiten pro Monat lassen sich auch große Druckvolumina realisieren. Somit unterstützt Sie der 520TN ideal bei allen anfallenden Arbeitsaufträgen.  |Kopiererhaus > Drucker|499.00|4-7 Tage|https://www.kopiererhaus.de/hp-laserjet-5200tn-q7545a-bis-a3|https://www.kopiererhaus.de/media/catalog/product/7/7/775434276_953161.jpg|35.00
775435021||Q7546A|HP|HP LaserJet 5200DTN - Q7546A bis A3|Duplexdruck, Überformat A3 und eine erstklassige Druckauflösung von 1.200 dpi. Mit dem vom Fachmann aufgearbeiteten HP LaserJet 5200DTN bleiben keine Wünsche offen. Sie produzieren regelmäßig Proofs von Marketingmaterial, architektonische Pläne, Kontenblätter und Tabellen? Dann ist dieser monochrome Laserdrucker aus dem Hause Hewlett Packard die erste Wahl. Gestochen scharfe Texte, klare Linien, satte Schwarztöne und weiche Graustufen sichern die Professionalität Ihrer Geschäftsunterlagen. Dank Netzwerkschnittstelle und USB-Port lässt sich das Gerät von allen Arbeitsgruppenmitgliedern einfach und intuitiv nutzen. Verarbeiten Sie problemlos die Formate A6, A5, A4 und A3 in Grammaturen von 60g/m² bis zu 199g/m². Das Tischgerät besticht mit einer Druckgeschwindigkeit von 35 Seiten pro Minute und einer empfohlenen Auslastung von bis zu 65.000 Seiten im Monat - so sind auch große Druckvolumina kein Problem mehr.  |Kopiererhaus > Drucker|599.00|4-7 Tage|https://www.kopiererhaus.de/hp-laserjet-5200dtn-q7546a-bis-a3|https://www.kopiererhaus.de/media/catalog/product/7/7/775435021_590246.jpg|35.00
775565481||CB503A|HP|HP Color LaserJet CP4005N - CB503A|Starke Leistung und exzellente Druckqualtität: Der vom Fachmann generalüberholte & gebrauchte HP Color LaserJet CP4005N ist konzipiert für Arbeitsteams in kleinen bis mittleren Unternehmen, die einen zuverlässigen und preisgünstigen Drucker für große Mengen an Bürodokumenten in Farbe und Schwarzweiß benötigen. Mit dem HP Color LaserJet CP4005N können Sie schnell und effizient arbeiten, mit einer hohen Geschwindigkeit von bis zu 25 S./Min. in Farbe und bis zu 30 S./Min. in Schwarzweiß. Dank HP Instant-on-Technologie wird beim Color LaserJet CP4005N eine schnelle Ausgabe der ersten Seite realisiert - sogar aus dem Stromsparmodus heraus. Der HP Color LaserJet CP4005N bewältigt selbst hohe Druckvolumen dank flexibler Papierzuführung, denn über eine 500-Blatt-Papierzuführung lässt sich die maximale Kapazität auf 1.100 Blatt erweitern.|Kopiererhaus > Drucker|479.00|4-7 Tage|https://www.kopiererhaus.de/hp-color-laserjet-cp4005n-cb503a|https://www.kopiererhaus.de/media/catalog/product/7/7/775565481_571248.jpg|35.00
775571601||CB504A|HP|HP Color LaserJet CP4005DN - CB504A|HP Zuverlässigkeit verbunden mit Langlebigkeit: Der vom Profi aufbereitete & gebrauchte HP Color LaserJet CP4005DN macht keine Kompromisse bei der Geschwindigkeit und Qualität: einfach den Druckauftrag starten und dank HP ImageREt 3600 werden mit dem Color LaserJet CP4005DN stets schnelle Ausdrucke mit konsistent hoher Druckqualität erzielt. Der HP ColorSphere Toner des HP Color LaserJet CP4005DN ergibt einen noch höheren Glanz zur optimalen Wiedergabe kräftiger Farben und sorgt in Kombination mit dem erweiterten HP ImageREt 3600 Seite für Seite für exzellente Farbtreue und realistische Bilder. Der CP4005DN Duplexer garantiert Ihnen sorgenfreies Drucken, da die automatische Farbkalibrierung und die HP Smart Druck-technologie der HP Druckkassetten eine optimale Druckqualität sicherstellen.|Kopiererhaus > Drucker|549.00|4-7 Tage|https://www.kopiererhaus.de/hp-color-laserjet-cp4005dn-cb504a|https://www.kopiererhaus.de/media/catalog/product/7/7/775571601_436741.jpg|35.00
784601841||CC520A|HP|HP Color LaserJet CM3530FS MFP - CC520A|Verbessern Sie Ihre Ausdrucke: Der top runderneuerte & gebrauchte HP Color LaserJet CM3530FS mit halbautomatischem Hefter ist genau die richtige Wahl für kleine Arbeitsgruppen mit 3-10 Benutzern in Unternehmen aller Größen, die ein kompaktes, zuverlässiges und benutzerfreundliches Multifunktionsgerät für die Erstellung unterschiedlicher, qualitativ hochwertiger Geschäftsdokumente benötigen. Der HP Color LaserJet CM3530FS liefert Ihnen eine hervorragende Druckqualität durch HP ImageREt 3600 und verbessertem HP ColorSphere Toner. Zudem können Sie mit dem HP Color LaserJet CM3530FS MFP auf einfache Weise kommunizieren und Informationen per Fax austauschen. Auch sind Ihre Daten beim HP Color LaserJet CM3530FS durch eine Zugriffskontrolle der Festplatte und ein integriertes Kartenlesegerät bestens geschützt.|Kopiererhaus > Farbkopierer|949.00|4-7 Tage|https://www.kopiererhaus.de/hp-color-laserjet-cm3530fs-mfp-cc520a|https://www.kopiererhaus.de/media/catalog/product/7/8/784601841_261765.jpg|35.00
817007266||CB532A|HP|HP Laserjet M2727NF MFP - CB532A|Ein Multifunktionsgerät wie es im Buche steht: Der HP Laserjet M2727NF MFP liefert ausgezeichnete Druckergebnisse und überzeugt durch reibungsloses , wartungsarmes Handling. Vom Profi aufbereitet ist er der perfekte Bürohelfer für kleine bis mittelständische Unternehmen und Teams, die mit einem leistungsstarken Gerät den Turbo anwerfen wollen. Mit einer Druckgeschwindigkeit von bis zu 26 Seiten pro Minute und einer Druckauflösung von 1.200 dpi liefert der Schwarzweiß-Laserdrucker konstant zufriedenstellende Druckergebnisse in kürzester Zeit und kann darüber hinaus auch in den Disziplinen Kopie, Scan und Fax überzeugen. Dank Netzwerkschnittstelle und USB-Port nutzen alle Teammitglieder das Gerät eigenständig mit wenigen Handgriffen. Speichern Sie bis zu 600 Seiten auf dem internen Speicher Ihres neuen Faxgeräts und produzieren Sie hochqualitative Scans mit dem CCD-Scanner. Eine hohe Tiefenschärfe und Instant-on-LED-Beleuchtung garantieren eine hochwertige Dokumenten-Digitalisierung - von der Rechnung bis zum 3D-Objekt.  |Kopiererhaus > Kopierer s/w|449.00|4-7 Tage|https://www.kopiererhaus.de/hp-laserjet-m2727nf-cb532a|https://www.kopiererhaus.de/media/catalog/product/8/1/817007266_383256.jpg|35.00
817009086||CB533A|HP|HP Laserjet M2727NFS MFP - CB533A|Umfangreich ausgestatttet: Der vom Fachmann top generalüberholte & gebrauchte HP Laserjet M2727NFS MFP ist ein äußerst zuverlässiger HP MFP für ausgezeichnete Ergebnisse und problemlosen Druckbetrieb. Durch schnelle Geschwindigkeiten von 26 S./Min., eine konstant ausgezeichnete Qualität, Netzwerkbetrieb, eine neue Faxlösung und zahlreiche zusätzliche Funktionen können mit dem HP Laserjet M2727NFS starke Produktivitätssteigerungen erzielt werden. Die erste Seite gibt der HP Laserjet M2727NFS dank der Instant-on-Technologie in weniger als 10 Sekunden aus, sogar aus dem Stromsparmodus heraus. Kopieraufträge können mit dem HP Laserjet M2727NFS ebenso schnell ausgeführt werden. Weniger Unterbrechungen mit einer maximalen Kapazität der Papierzuführung von 500 Blatt steigern beim HP Laserjet M2727NFS Ihren Workflow. Zudem können Sie Aufträge durch Sortieren von Kopien, beidseitigen Druck und eine elektronische Stapeleinrichtung mit dem HP Laserjet M2727NFS MFP schneller ausführen. Mit dem 450 MHz Prozessor und einem 64 MB Speicher, der auf 320 MB erweitert werden kann, können große, komplexe Aufträge mit dem HP Laserjet M2727NFS problemlos verarbeitet und schnell ausgeben werden.|Kopiererhaus > Kopierer s/w|499.00|4-7 Tage|https://www.kopiererhaus.de/hp-laserjet-m2727nfs-mfp-cb533a|https://www.kopiererhaus.de/media/catalog/product/8/1/817009086_862353.jpg|35.00
820100111||CB512A|HP|HP Laserjet P4014DN - CB512A|Ideal für Arbeitsgruppen mit 5 bis 10 Benutzern in kleinen und mittelständischen Unternehmen, die hohe Druckvolumen in professioneller Qualität erstellen müssen. Zuverlässiges, schnelles und kostengünstiges Schwarzweiß Drucken für Arbeitsgruppen. Einfacher, intuitiver Drucker mit außergewöhnlicher Bedienerfreundlichkeit. Betrieb und Wartung des Druckers auch ohne Unterstützung durch IT-Personal. Einfache Druckerkonfiguration und Fehlerbehebung dank Anleitungsfunktionen auf dem Bedienfeld. Weniger Störungen und einwandfreie Arbeitsabläufe mit optionalem Zubehör für die Papierhandhabung, wie beispielsweise zusätzlichen 500-Blatt-Papierfächern oder 1.500-Blatt-Papierfach, Duplex-Einheit für automatischen beidseitigen Druck oder Briefumschlagzuführung, sowie Ausgabeoptionen wie 5-Fach-Ablage, Stapelfach oder Stapelfach mit Hefter. Drucken auf verschiedenen Medientypen und -formaten gemäß dem jeweiligen Geschäftsbedarf. Erhöhung der Leistung und der Speicherkapazität mit optionaler EIO-Festplatte.|Kopiererhaus > Drucker|439.00|4-7 Tage|https://www.kopiererhaus.de/hp-laserjet-p4014dn-cb512a|https://www.kopiererhaus.de/media/catalog/product/p/4/p4014.jpg|35.00
824688826||1102HL3EU0|Kyocera|Kyocera FS-C5100DN - 1102HL3EU0|Mit dem FS-C5100DN wird Farbe jetzt für jedes Office erschwinglich. Denn das Office-Talent überzeugt nicht nur durch perfekte Office-Qualität bei höchster Zuverlässigkeit, sondern auch durch niedrigste Seitenpreise. Neben dem schönen F.A. Porsche Design beeindruckt auch die exzellente Ausstattung: Duplex-Einheit, Netzwerkschnittstelle und die 150 Blatt Multifunktionszufuhr garantieren höchste Flexibilität bei der Arbeit.|Kopiererhaus > Drucker|259.00|4-7 Tage|https://www.kopiererhaus.de/kyocera-fs-c5100dn-1102hl3eu0|https://www.kopiererhaus.de/media/catalog/product/8/2/824688826_980818.jpg|35.00
825222621||Q1321A|HP|HP Color LaserJet 3700 - Q1321A|Farbe im Büro: Der professionell runderneuerte & gebrauchte HP Color LaserJet 3700 überzeugt mit ausgezeichnetem Preis-Leistungs Verhältnis und bietet bewährte Druckqualität, Bedienerfreundlichkeit, Druckgeschwindigkeit und Zuverlässigkeit von HP, um Sie bei der Erstellung einer Vielzahl von Farbdokumenten zu unterstützen. Mit dem HP Color LaserJet 3700 erzielen Sie großartige Ergebnisse mit einer Druckgeschwindigkeit von bis zu 16 S./Min.in Farbe und Schwarzweiß und mit dem erweiterbaren Speicher von 128 MB auf bis zu 448 MB RAM können Sie selbst komplexe Druckaufträge absolut spielend bewältigen. Nutzen Sie die Vorteile eines schnellen und effizienten Betriebs beim HP Color LaserJet 3700 dank der Gestaltung des HP All-in-One Zubehörs - Sie müssen weniger Verbrauchsmaterialien nachbestellen und warten. Der bedienerfreundliche und erweiterbare Color LaserJet 3700 wird Ihnen beeindruckende Ergebnisse liefern - Ausdruck für Ausdruck.|Kopiererhaus > Drucker|349.00|3-4 Tage|https://www.kopiererhaus.de/hp-color-laserjet-3700-q1321a|https://www.kopiererhaus.de/media/catalog/product/8/2/825222621_383172.jpg|35.00
825224211||Q1322A|HP|HP Color LaserJet 3700N - Q1322A|Schnell, professionell, kostengünstig: Der professionell runderneuerte & gebrauchte HP Color LaserJet 3700N eignet sich optimal für anspruchsvolle Einzelanwender, kleine und mittlere Unternehmen und Arbeitsgruppen von 2 bis 15 Anwendern, die ihren Drucker gemeinsam im Netzwerk nutzen wollen. Die Farbwiedergabe beim HP Color LaserJet 3700N wird Dank der HP ImageREt 2400 Technologie und einem verbesserten elektrofotografischen Prozess im System des 3700N und den Druckkassetten zusätzlich optimiert. Das HP All-in-One Zubehör des Color LaserJet 3700N wurde für einen schnellen und effizienten Betrieb und eine lange Lebensdauer konzipiert und muss nicht mehr so häufig nachbestellt und gewartet werden.|Kopiererhaus > Drucker|369.00|3-4 Tage|https://www.kopiererhaus.de/hp-color-laserjet-3700n-q1322a|https://www.kopiererhaus.de/media/catalog/product/3/7/3700n.jpg|35.00
825232791||Q1323A|HP|HP Color LaserJet 3700DN - Q1323A|Optimales Preis-Leistungs Verhältnis: Der fachmännisch runderneuerte & gebrauchte HP Color LaserJet 3700DN liefert Ihnen eine ausgezeichnete Druckqualität und professionell gestaltete Ergebnisse mit der HP ImageREt 2400Image Refinement Technologie, weiterentwickelter Tonerformel und optimierten HP Druckmedien. Der HP Color LaserJet 3700DN garantiert einen schnellen Ausdruck der ersten Seite dank derHP Instant-On-Technologie der Fixierereinheit, auch wenn der Color LaserJet 3700DN ausgeschaltet war bzw. sich in Bereitschaft befindet. Das Auto Duplex und die leichte Integrierbarkeit in Ihr Netzwerk optimieren beim HP Color LaserJet 3700DN den Arbeitsfluss und zusätzlich werden Betriebskosten minimiert. So ist der flotte und farbbrillante Color LaserJet 3700DN eine clevere Investition, die sich schnell bezahlt macht.|Kopiererhaus > Drucker|399.00|3-4 Tage|https://www.kopiererhaus.de/hp-color-laserjet-3700dn-q1323a|https://www.kopiererhaus.de/media/catalog/product/8/2/825232791_217282.jpg|35.00
825232901||Q1324A|HP|HP Color LaserJet 3700DTN - Q1324A|Professionell gestaltete Ergebnisse: Der vom Fachmann top aufbereitete & gebrauchte HP Color LaserJet 3700DTN überzeugt mit einfacher Bedienung, Wartung und Installation. Mit Auto Duplex, Netzwerkfähigkeit und einer extra 500 Blatt Papierzuführung beim Color LaserJet 3700DTN werden auch große Druckvolumen in Ihrer Arbeitsgruppe spielend leicht geschafft. Der HP Color LaserJet 3700DTN ist die optimale Verbindung zwischen professioneller Druckqualität und einem guten Preis-Leistungs Verhältnis. Sowohl der 3700DTN als auch das Druckkassettensystem wurden vor allem für kleine Unternehmen ohne IT-Unterstützung entwickelt.|Kopiererhaus > Drucker|449.00|3-4 Tage|https://www.kopiererhaus.de/hp-color-laserjet-3700dtn-q1324a|https://www.kopiererhaus.de/media/catalog/product/8/2/825232901_975898.jpg|35.00
825234541||8B62HNE0|Kyocera|Kyocera FS-C5300DN - 8B62HNE0|Mit Sicherheit produktiv: Der fachmännisch runderneuerte & gebrauchte Kyocera FS-C5300DN überzeugt mit rasanten 26 Seiten pro Minute, Duplex, einer blendenden Netzwerk-Performance und niedrigsten Seitenpreisen. Intelligente Sicherheitsfunktionen schützen beim Kyocera FS-C5300DN sensible Daten vor unbefugtem Zugriff. Zudem ist der Kyocera FS-C5300DN perfekt für große Druckvolumen: die 500 Blatt-Standard-Kassette und optionale Zuführungen für eine Gesamtkapazität von bis zu 2.150 Blatt. Auch sonst hält der FS-C5300DN, was das F.A. Porsche Design verspricht - neben brillanter Office-Qualität in satten Farben bietet er eine exzellente Ausstattung für flexibles Arbeiten. Und Dank modernster IP-Filter und ausgereifter SSL-Verschlüsselungs-Technologie wird die Sicherheit im Netzwerk mit dem FS-C5300DN deutlich erhöht.|Kopiererhaus > Drucker|399.00|4-7 Tage|https://www.kopiererhaus.de/kyocera-fs-c5300dn-8b62hne0|https://www.kopiererhaus.de/media/catalog/product/8/2/825234541_771689.jpg|35.00
825241386||1102K83NL0|Kyocera|Kyocera FS-C5350DN - 1102K83NL0|Mit Sicherheit produktiv: Der FS-C5350DN überzeugt mit rasanten 26 Seiten pro Minute, einer blendenden Netzwerk-Performance und niedrigsten Seitenpreisen. Intelligente Sicherheitsfunktionen schützen dabei sensible Daten vor unbefugtem Zugriff. Auch sonst hält er, was das F.A. Porsche Design verspricht - neben brillanter Office-Qualität in satten Farben bietet er eine exzellente Ausstattung für flexibles Arbeiten. Dank modernster IP-Filter und ausgereifter SSL-Verschlüsselungs-Technologie wird die Sicherheit im Netzwerk deutlich erhöht.|Kopiererhaus > Drucker|399.00|4-7 Tage|https://www.kopiererhaus.de/kyocera-fs-c5350dn-1102k83nl0|https://www.kopiererhaus.de/media/catalog/product/8/2/825241386_750657.jpg|35.00
826183046||Q3668A|HP|HP Color LaserJet 4650 - Q3668A|Großartige Farbergebnisse: Der vom Fachmann generalüberholte & gebrauchte HP Color LaserJet 4650 steigert Ihre Produktivität und lässt Sie von der bewährten HP Farblaserqualität in Verbindung mit komfortabler und zuverlässiger Netzwerkleistung für Arbeitsgruppen profitieren. Mit dem HP Color LaserJet 4650 drucken Sie farbige Dokumente mit bis zu 22 S./Min., und nutzen die Vorteile der großen Papierzuführungskapazität. Der HP Color LaserJet 4650 wurde für die gemeinsame Nutzung im Netzwerk für Arbeitsgruppen mit bis zu 20 Anwendern in kleinen, mittleren und großen Unternehmen konzipiert, die einen qualitativ hochwertigen Drucker suchen, der flexibel, zuverlässig, kostengünstig und gleichzeitig einfach zu installieren, zu verwenden, zu bedienen und zu verwalten ist.|Kopiererhaus > Drucker|299.00|4-7 Tage|https://www.kopiererhaus.de/hp-color-laserjet-4650-q3668a|https://www.kopiererhaus.de/media/catalog/product/8/2/826183046_544260.jpg|35.00
826184891||Q3669A|HP|HP Color LaserJet 4650N - Q3669A|Farbdokumente die Eindruck hinterlassen: Der professionell runderneuerte & gebrauchte HP Color LaserJet 4650N hat eine reduzierte Anlaufzeit dank schneller Kalibrierungszyklen. Dank der schnellen Ausgabe der ersten Seite bereits nach 15 Sekunden müssen Sie beim HP Color LaserJet 4650N nie lange auf Ihre Farbdokumente warten. Ein Hochleistungsprozessor mit 533 MHz und ein Speichervolumen von bis zu 544 MB sorgen dafür, dass sich selbst komplexe Dokumente mit Bildern und Grafiken mit dem Color LaserJet 4650N absolut problemlos ausdrucken lassen. Bei eiligen Projekten ermöglicht die HP Smart Drucktechnologie des Color LaserJet 4650N die Fortsetzung des Ausdrucks einer begrenzten Anzahl von Seiten nur mit der schwarzen Patrone, wenn eine Farbpatrone leer ist.|Kopiererhaus > Drucker|349.00|4-7 Tage|https://www.kopiererhaus.de/hp-color-laserjet-4650n-q3669a|https://www.kopiererhaus.de/media/catalog/product/8/2/826184891_590749.jpg|35.00
826186261||Q3670A|HP|HP Color LaserJet 4650DN - Q3670A|Auf die Plätze, Fertig, Drucken: Der von Ihrem Profi runderneuerte & gebrauchte HP Color LaserJet 4650DN liefert Ihnen großartige Ergebnisse mit qualitativ hochwertigen Farbdokumenten, die garantiert Eindruck hinterlassen. Der HP Color LaserJet 4650DN sorgt mit einer Kombination aus HP ImageREt 3600, einer patentierten Drucktechnologie und chemisch erzeugtem Toner, weiche Farbübergänge, gestochen scharfen Text und Bilder. Zudem erzielen Sie mit dem HP Color LaserJet 4650DN professionelle Ergebnisse für Ihre Brochüren dank der optimierten Druckleistung auf HP LaserJet Hochglanzpapier.|Kopiererhaus > Drucker|389.00|4-7 Tage|https://www.kopiererhaus.de/hp-4650dn-q3670a|https://www.kopiererhaus.de/media/catalog/product/8/2/826186261_794507.jpg|35.00
826595931||Q7491A|HP|HP Color LaserJet 4700 - Q7491A|Überzeugende Leistung und Qualität: Der vom Fachmann generalüberholte & gebrauchte HP Color LaserJet 4700 hilft Arbeitsgruppen ihre Produktivität nachhaltig zu steigern. Der HP Color LaserJet 4700 bietet eine überzeugende Druckleistung in Verbindung mit exzellenter Druckqualität. Verschiedenste Dokumente lassen sich mit dem Color LaserJet 4700 in brillanten Farben schnell und einfach eindrucksvoll erstellen und der LaserJet 4700 eignet sich bestenes für verwaltete Arbeitsgruppen mit einem hohen Druckaufkommen in kleinen und mittleren Unternehmen, die einen leistungsstarken Farbdrucker in DIN A4 für die Erstellung ihrer professionellen Geschäftsunterlagen benötigen. Die ausgezeichnete Druckqualität beim HP Color LaserJet 4700 wird durch den neuen HP ColorSphere Toner gewährleistet, der leuchtende und lebhafte Farben ermöglicht, sowie mit gestochen scharfem Text überzeugt.|Kopiererhaus > Drucker|449.00|4-7 Tage|https://www.kopiererhaus.de/hp-color-laserjet-4700-q7491a|https://www.kopiererhaus.de/media/catalog/product/8/2/826595931_173415.jpg|35.00
832352896||C4781A|HP|HP Papierfach 2000 Blatt für HP Laserjet 8000, 8100, 8150, 8500, 8550 - C4781A|Höhere Papierkapazität heißt weniger Unterbrechungen der alltäglichen Arbeit. Automatisches Drucken auf zwei verschiedenen Papiersorten, z. B. Normalpapier und Papier für Hochglanzbroschüren, ohne manuelles Laden des Papierfachs vor jedem Druckauftrag. Sparen Sie Zeit, und verbessern Sie die Leistung einzelner Mitarbeiter und Arbeitsgruppen dank der höheren Kapazität dieses 2000-Blatt-Papierfachs von HP. Bei einer höheren Ladekapazität müssen die Benutzer seltener Papier einlegen. Die Installation dieses Papierfaches ist sehr einfach: Drucker ausschalten, den Drucker auf das Papierfach stellen, den Drucker anschalten und die Zuführung wird automatisch erkannt.|Kopiererhaus > Toner & Zubehör|109.00|4-7 Tage|https://www.kopiererhaus.de/hp-papierfach-2000-blatt-fuer-hp-laserjet-8000-8100-8150-8500-8550-c4781a|https://www.kopiererhaus.de/media/catalog/product/8/3/832352896_926310.jpg|35.00
832366206||C8531A|HP|HP Papierfach 2.000 Blatt für HP Laserjet 9000 - C8531A|Höhere Papierkapazität heißt weniger Unterbrechungen der alltäglichen Arbeit. Automatisches Drucken auf zwei verschiedenen Papiersorten, z. B. Normalpapier und Papier für Hochglanzbroschüren, ohne manuelles Laden des Papierfachs vor jedem Druckauftrag. Sparen Sie Zeit, und verbessern Sie die Leistung einzelner Mitarbeiter und Arbeitsgruppen dank der höheren Kapazität dieses 2000-Blatt-Papierfachs von HP. Bei einer höheren Ladekapazität müssen die Benutzer seltener Papier einlegen. Die Installation dieses Papierfaches ist sehr einfach: Drucker ausschalten, den Drucker auf das Papierfach stellen, den Drucker anschalten und die Zuführung wird automatisch erkannt.|Kopiererhaus > Toner & Zubehör|290.00|4-7 Tage|https://www.kopiererhaus.de/hp-papierfach-2000-blatt-fuer-hp-laserjet-9000-c8531a|https://www.kopiererhaus.de/media/catalog/product/8/3/832366206_928763.jpg|35.00
832404481||083FX0KX|Kyocera|Kyocera Papierfach 2 x 500 Blatt PF-30A - 083FX0KX|Höhere Papierkapazität heißt weniger Unterbrechungen der alltäglichen Arbeit. Sparen Sie Zeit, und verbessern Sie die Leistung einzelner Mitarbeiter und Arbeitsgruppen dank der höheren Kapazität dieses Papierfachs. Bei einer höheren Ladekapazität müssen die Benutzer seltener Papier einlegen. Die Installation dieses Papierfaches ist sehr einfach: Drucker ausschalten, den Drucker auf das Papierfach stellen, den Drucker anschalten und die Zuführung wird automatisch erkannt. Die Zufuhr kann direkt über den Windows Druckmanager angesteuert werden.|Kopiererhaus > Toner & Zubehör|165.00|4-7 Tage|https://www.kopiererhaus.de/kyocera-papierfach-2-x-500-blatt-pf-30a-083fx0kx|https://www.kopiererhaus.de/media/catalog/product/8/3/832404481_500912.jpg|35.00
832803661||023CF513|Kyocera|Kyocera Papierfach 2 x 500 Blatt PF-70 - 023CF513|Höhere Papierkapazität heißt weniger Unterbrechungen der alltäglichen Arbeit. Sparen Sie Zeit, und verbessern Sie die Leistung einzelner Mitarbeiter und Arbeitsgruppen dank der höheren Kapazität dieses Papierfachs. Bei einer höheren Ladekapazität müssen die Benutzer seltener Papier einlegen. Die Installation dieses Papierfaches ist sehr einfach: Drucker ausschalten, den Drucker auf das Papierfach stellen, den Drucker anschalten und die Zuführung wird automatisch erkannt. Die Zufuhr kann direkt über den Windows Druckmanager angesteuert werden.|Kopiererhaus > Toner & Zubehör|97.00|4-7 Tage|https://www.kopiererhaus.de/kyocera-papierfach-2-x-500-blatt-pf-70-023cf513|https://www.kopiererhaus.de/media/catalog/product/8/3/832803661_700051.jpg|35.00
872675586||1102G53NL0|Kyocera|Kyocera FS-1116MFP - 1102G53NL0|Höchste Flexibilität und Erweiterbarkeit: Der von Ihrem Fachmann aufbereitete & gebrauchte Kyocera FS-1116MFP ist Ihr Workflow Partner für drucken, kopieren, farbscannen und sogar standardmäßig faxen. Der Kyocera FS-1116MFP ist die perfekte Wahl fürs kleine Büro und für das Home-Office. Mit bis zu 16 Seiten Druck und Kopie pro Minute in A4 macht der FS-1116MFP dabei richtig Tempo. Für brillante Druckergebnisse sorgt beim Kyocera FS-1116MFP die Auflösung von 600 dpi und Dank der 250 Blatt Papierkassette plus Einzelblatteinzug erledigen sie auch umfangreichere Jobs locker an einem Stück. Apropos: Ihren Geldbeutel schonen der FS-1116MFP natürlich auch durch die niedrigsten Seitenpreise in seiner Geräteklasse!|Kopiererhaus > Kopierer s/w|199.00|4-7 Tage|https://www.kopiererhaus.de/kyocera-fs-1116mfp-1102g53nl0|https://www.kopiererhaus.de/media/catalog/product/8/7/872675586_177111.jpg|35.00
